[
  {
    "id": "com.github.skalesapp/daily-brief",
    "name": "Daily Brief",
    "version": "1.0.0",
    "minAppVersion": "12.9.0",
    "description": "A morning brief written while you sleep - notes and calendar into one page",
    "author": "Skales",
    "class": "automation",
    "platforms": [
      "desktop"
    ],
    "permissions": {
      "network": false,
      "filesystem": "pluginRoot",
      "tools": [
        "list_directory",
        "list_scheduled_tasks",
        "list_tasks",
        "memory_search",
        "read_file",
        "write_file"
      ]
    },
    "repo": "skalesapp/plugins",
    "path": "first-party/daily-brief",
    "firstParty": true,
    "addedAt": "2026-08-26"
  },
  {
    "id": "com.github.skalesapp/reading-stack",
    "name": "Reading Stack",
    "version": "1.0.0",
    "minAppVersion": "12.9.0",
    "description": "A reading list that works offline - save links, let the agent summarize",
    "author": "Skales",
    "class": "agent",
    "platforms": [
      "desktop"
    ],
    "permissions": {
      "network": false,
      "filesystem": "pluginRoot",
      "tools": [
        "extract_web_text"
      ]
    },
    "repo": "skalesapp/plugins",
    "path": "first-party/reading-stack",
    "firstParty": true,
    "addedAt": "2026-08-26"
  }
]
